{
  "$schema": "../../types/schema.json",
  "id": "serge-martin",
  "name": "Serge Martin",
  "headOfList": "Serge Martin",
  "parties": ["Indépendant"],
  "logoUrl": "/images/serge-martin.png",
  "candidatePictureUrl": "/images/serge-martin.png",
  "fame": 4,
  "website": "",
  "socials": {},
  "program": [],
  "presentation": {
    "fr": "**Serge Martin** a annoncé sa candidature aux élections municipales de 2026 à Montpellier en dehors de tout parti politique structuré. Sa démarche s’inscrit dans le cadre d’une **candidature indépendante**, portée à titre personnel, sans rattachement revendiqué à une organisation nationale ou à un mouvement politique existant.\n\n### Une démarche hors partis politiques\n\nSi Serge Martin se présente aujourd’hui comme candidat indépendant, il a déjà participé à une élection municipale à Montpellier. Lors des élections municipales précédentes, il figurait en effet sur la **liste conduite par Mohed Altrad**.\n\nCet élément permet de situer son parcours politique récent et d’inscrire sa candidature actuelle dans une continuité d’engagement municipal, bien que sous une forme différente.\n\nSerge Martin revendique une candidature **sans étiquette partisane**, fondée sur une volonté de s’adresser directement aux habitant·es de Montpellier.\n\nCette posture s’inscrit dans une tradition de candidatures municipales indépendantes qui mettent en avant :\n\n* une critique du fonctionnement des partis politiques ;\n* la volonté de dépasser les clivages partisans classiques ;\n* une approche présentée comme pragmatique et centrée sur le local.\n\nÀ ce stade, la candidature de Serge Martin ne s’inscrit pas dans un cadre collectif structuré comparable à celui des listes portées par des mouvements politiques organisés.",
    "en": "**Serge Martin** has announced his candidacy for the 2026 municipal elections in Montpellier outside of any structured political party. His approach falls within the framework of an **independent candidacy**, pursued personally, without claiming affiliation with a national organization or an existing political movement.\n\n### An Approach Outside Political Parties\n\nWhile Serge Martin is now running as an independent candidate, he has previously participated in a municipal election in Montpellier. In the previous municipal elections, he was indeed on the **list led by Mohed Altrad**.\n\nThis element helps to contextualize his recent political career and to place his current candidacy within a continuity of municipal engagement, albeit in a different form.\n\nSerge Martin advocates for a **non-partisan** candidacy, based on a desire to address the residents of Montpellier directly.\n\nThis stance aligns with a tradition of independent municipal candidacies that highlight:\n\n* a critique of the functioning of political parties;\n* the desire to transcend classic partisan divisions;\n* an approach presented as pragmatic and locally focused.\n\nAt this stage, Serge Martin's candidacy does not fit into a structured collective framework comparable to that of lists put forward by organized political movements.",
    "es": "**Serge Martin** ha anunciado su candidatura para las elecciones municipales de 2026 en Montpellier fuera de cualquier partido político estructurado. Su enfoque se inscribe en el marco de una **candidatura independiente**, impulsada a título personal, sin vinculación declarada a una organización nacional o a un movimiento político existente.\n\n### Un enfoque al margen de los partidos políticos\n\nAunque Serge Martin se presenta hoy como candidato independiente, ya participó en unas elecciones municipales en Montpellier. En las elecciones municipales anteriores, figuró de hecho en la **lista encabezada por Mohed Altrad**.\n\nEste elemento permite situar su trayectoria política reciente e inscribir su actual candidatura en una continuidad de compromiso municipal, aunque bajo una forma diferente.\n\nSerge Martin reivindica una candidatura **sin etiqueta partidista**, fundada en la voluntad de dirigirse directamente a los habitantes de Montpellier.\n\nEsta postura se enmarca en una tradición de candidaturas municipales independientes que destacan:\n\n* una crítica al funcionamiento de los partidos políticos;\n* la voluntad de superar las divisiones partidistas clásicas;\n* un enfoque presentado como pragmático y centrado en lo local.\n\nEn esta fase, la candidatura de Serge Martin no se inscribe en un marco colectivo estructurado comparable al de las listas presentadas por movimientos políticos organizados.",
    "oc": "**Serge Martin** a anonciat la siá candidatura a las eleccions municipalas de 2026 a Montpelhièr fòra de tot partit politic estructurat. La siá dralha s’inscrich dins l’encastre d’una **candidatura independenta**, portada a títol personal, sens restacament revendicat a una organizacion nacionala o a un movement politic existent.\n\n### Una dralha fòra partits politics\n\nSe Serge Martin se presenta uèi coma candidat independent, a ja participat a una eleccion municipala a Montpelhièr. Al moment de las eleccions municipalas precedentas, figurava en efièch sus la **lista menada per Mohed Altrad**.\n\nAqueste element permet de situar son percors politic recent e d’inscriure la siá candidatura actuala dins una continuitat d’engatjament municipal, e mai jos una forma diferenta.\n\nSerge Martin revendica una candidatura **sens etiqueta partisana**, fondada sus una volontat de s’adreçar dirèctament als abitants de Montpelhièr.\n\nAquesta postura s’inscrich dins una tradicion de candidaturas municipalas independentas que meton en avant :\n\n* una critica del foncionament dels partits politics ;\n* la volontat de despassar los clivatges partisans classics ;\n* una apròchi presented coma pragmatica e centrada sul local.\n\nAl moment, la candidatura de Serge Martin s’inscrich pas dins un encastre collectiu estructurat comparable a aqueste de las listas portadas per de movements politics organizats.",
    "ar": "**سيرج مارتن** أعلن ترشحه للانتخابات البلدية لعام 2026 في مونبلييه خارج أي حزب سياسي منظم. يندرج نهجه ضمن إطار **ترشح مستقل**، مقدم بصفة شخصية، دون انتساب معلن لمنظمة وطنية أو حركة سياسية قائمة.\n\n### نهج خارج الأحزاب السياسية\n\nإذا كان سيرج مارتن يتقدم اليوم كمرشح مستقل، فقد شارك بالفعل في انتخابات بلدية سابقة في مونبلييه. ففي الانتخابات البلدية السابقة، كان ضمن **القائمة التي قادها محمد ألتراد**.\n\nيسمح هذا العنصر بتحديد مساره السياسي الأخير وإدراج ترشحه الحالي ضمن استمرارية الالتزام البلدي، وإن كان بشكل مختلف.\n\nيطالب سيرج مارتن بترشح **بدون انتماء حزبي**، يقوم على الرغبة في التوجه مباشرة إلى سكان مونبلييه.\n\nيتماشى هذا الموقف مع تقليد الترشحات البلدية المستقلة التي تبرز:\n\n*   نقدًا لعمل الأحزاب السياسية؛\n*   الرغبة في تجاوز الانقسامات الحزبية التقليدية؛\n*   نهجًا يُقدم على أنه براغماتي ومُركز محليًا.\n\nفي هذه المرحلة، لا يندرج ترشح سيرج مارتن ضمن إطار جماعي منظم مماثل لذلك الذي تقدمه الحركات السياسية المنظمة."
  },
  "vision": {
    "fr": "## Positionnement politique et discours public\n\nLes prises de parole publiques associées à la candidature de Serge Martin mettent l’accent sur :\n\n* la proximité avec les habitant·es ;\n* la dénonciation d’un éloignement des institutions municipales vis-à-vis des réalités quotidiennes ;\n* une volonté de renouvellement des pratiques politiques locales.\n\nFaute de programme municipal détaillé rendu public à ce stade, il est difficile d’identifier des orientations politiques précises sur l’ensemble des compétences municipales.",
    "en": "## Political Positioning and Public Discourse\n\nPublic statements associated with Serge Martin's candidacy emphasize:\n\n* proximity to residents;\n* denunciation of a disconnect between municipal institutions and daily realities;\n* a desire for renewal in local political practices.\n\nDue to the lack of a detailed municipal program made public at this stage, it is difficult to identify precise political orientations across all municipal competencies.",
    "es": "## Posicionamiento político y discurso público\n\nLas declaraciones públicas asociadas a la candidatura de Serge Martin hacen hincapié en:\n\n* la proximidad con los habitantes;\n* la denuncia de un distanciamiento de las instituciones municipales respecto a las realidades cotidianas;\n* una voluntad de renovación de las prácticas políticas locales.\n\nA falta de un programa municipal detallado hecho público en esta etapa, resulta difícil identificar orientaciones políticas precisas sobre el conjunto de las competencias municipales.",
    "oc": "## Posicionament politic e discors public\n\nLas presas de paraula publicas associadas a la candidatura de Serge Martin meton l’accent sus :\n\n* la proximitat amb los abitants ;\n* la denonciacion d’un alunhament de las institucions municipalas fàcia a las realitats quotidianas ;\n* una volontat de renovacion de las practicas politicas localas.\n\nFauta de programa municipal detalhat rendut public a aqueste estadi, es dificil d’identificar d'orientacions politicas precisas sus l’ensemble de las competéncias municipalas.",
    "ar": "## الموقف السياسي والخطاب العام\n\nتركز التصريحات العامة المرتبطة بترشح سيرج مارتن على:\n\n*   القرب من السكان؛\n*   التنديد بابتعاد المؤسسات البلدية عن الواقع اليومي؛\n*   الرغبة في تجديد الممارسات السياسية المحلية.\n\nبسبب عدم وجود برنامج بلدي مفصل منشور حتى الآن، من الصعب تحديد توجهات سياسية دقيقة فيما يتعلق بجميع صلاحيات البلدية."
  }
}